,tweet
0, New 12  1TB WiFi Cell   Apple  iPad Pros for  1499 at B amp H   150 off  Free ship  
1,New 12  1TB WiFi Cell   Apple  iPad Pros for  1499 at B amp H   150 off  Free ship  
2, WordPress 3 1 para  iOS  wordpress   ipad
3,WordPress 3 1 para  iOS  wordpress   ipad
4, 2020 13  Intel 4 Core  Apple  MacBook Airs for  1099 at B amp H   200 off MSRP  Free ship  
5,2020 13  Intel 4 Core  Apple  MacBook Airs for  1099 at B amp H   200 off MSRP  Free ship  
6, 2020 13  Intel 2 Core  Apple  MacBook Airs for  869 at B amp H   130 off MSRP  Free ship  
7,2020 13  Intel 2 Core  Apple  MacBook Airs for  869 at B amp H   130 off MSRP  Free ship  
8,16  MacBook Pros remain on sale for up to  300 off Apple s MSRP at B amp H  starting at  2199      apple  macbook  macbookpro  macbookpro16  macbooksale     Details at B amp H here   gt   
9, AT amp T offers  700 discount on  Apple  iPhone 12 Pro Max or 12 Mini  
10,AT amp T offers  700 discount on  Apple  iPhone 12 Pro Max or 12 Mini  
11,High quality and Juicy Mandarin  RPI Traders are Mandarin   Grower  Processor  amp  Exporter all over the world from Pakistan  Inquire us   92 343 5099883  amp   92 348 0661611   export  pakistan  uk  Grower  Processor  Exporters   MandarinPakistan  freshfruit  freshfruits  fruits 
12,We are a Grower  Processor  amp  Exporters of high quality Mandarin in Pakistan  Call us for more information  92 343 5099883  amp   92 348 0661611   Grower  Processor  Exporters  Mandarin  MandarinPakistan  export  pakistan  uk  freshfruit  freshfruits  fruits 
13, These  Tech Accessories are  Patriotic  amp  One of a kind     MADEinUSA  tech  phonecase  laptop   
14, These  Tech Accessories are  Patriotic  amp  One of a kind     MADEinUSA  tech  phonecase  laptop   
15, Allen Solly  cashmere V Neck  sweater Men Size M   
16,Check out Brooks Brothers Mens Long Sleeve 1 4 Zip Front Sweater Large Green  via   menswear  sweater  brooksbrothers  WINTER  sweaterweather  christmassweater  HolidaySeason  giftideas  Christmas  present
17,Excited to share this item from my  etsy shop   Handmade  light  air  warm  rose  sweater  pullover  knit from kid  mohair  women s  clothing the finest  yarn women s sweater  good  gift for  women  abstract  longsleeve  boat  womensclothing  
18,Cyber Monday Up to 70  OFF  End time  07 12 2020   christmasshopping  blackfridaysale  womensfashion  trousers  christmasgifts  christmas  christmasdecor  winteroutfits  sweater  hoodie  shoes  bags  jewelry  winterseason  shawl  watch  Affiliatelink     
19,Check out my Gig on Fiverr  do ugly christmas tshirts and sweater design    christmastshirt  sweater  sweatertshirt  tshirts  tshirt  fiverr  graphicdesing  marchbyamazon  christmas  Christmas2020 
20, Women s Christmas Color Matching Print Sweater Mujer Long sleeved Sweatshirt Casual Woman Sweaters Turtleneck 9 13  https   
21, Banana Republic  sweater V Neck Men Size S Red  co 
22,   291 72   House of Harlow 1960 Womens Sweater Sand XSmall   House  of  Harlow  1960  Womens  Sweater  Sand  XSmall  fashion  lifestyle  Christmas2020   Follow the link to get it before the Christmas 
23,Wish You A Mayer Christmas Sweater     Buy here    Withyou  a  Mayer  Christmas  Sweater  youryourstyle  tshirt 
24, Excited to share this item from my  etsy shop  Chagall Womens Black Vintage Sweater with Floral Accents Medium  floral 
25,White silk  sweater  Ivory  bridal  jumper  Knitwear  handmade  designer by ANDADAclothing  via 
26, Check out Joie Womens Heather Gray Ribbed 100  Cashmere Sweater Small    sweater  sweaterwe 
27, Check out Vintage Alan Flusser Womens 100  Pure Cashmere Gray Lilac Blue Sweater XL     vin 
28, Check out Vintage Alan Flusser Womens 100  Pure Cashmere Gray Lilac Blue Sweater XL     vin 
29, New Christmas Men Women Hoodies Sweater Christmas Cute Elk Cosplay Sweater Unisex Leisure Festival Ugly Rudolph Reindeer Sw 
30,Check out Cha Cha Vente Top Shirt M Surplice V Neck Stretch Black Red White 3 4 Sleeve   Shirt  via 
31,Women in  Tornado Alley will totally understand this  shirt  
32, New Year s Eve Party Decoration   Collection 60  Off Holiday  amp  Christmas Cards  When You Buy 60 Or More  zazzle  holiday 
33, New Year s Eve Party Decoration   Collection 60  Off Holiday  amp  Christmas Cards  When You Buy 60 Or More  zazzle  holiday 
34, New Year s Eve Party Decoration   Collection 60  Off Holiday  amp  Christmas Cards  When You Buy 60 Or More  zazzle  holiday 
35, New Year s Eve Party Decoration   Collection 60  Off Holiday  amp  Christmas Cards  When You Buy 60 Or More  zazzle  holiday 
36, New Year s Eve Party Decoration   Collection 60  Off Holiday  amp  Christmas Cards  When You Buy 60 Or More  zazzle  holiday 
37,Women s Colorful Casual Shoulder Bag  design  shirt  
38, Luxury Handbag Women Bags Designer Brand Leather Handbags Vintage Crossbody Bags for Women 2020 New Shoulder Bag Tote 
39, Women s Chains Decorated Leather Tote Bag design  shirt  
40, Dolce amp Gabbana GOLD Men Dress  shirt 15 3 4 32 33 S 
41, New Year s Eve Party Decoration   Collection 60  Off Holiday  amp  Christmas Cards  When You Buy 60 Or More  zazzle  holiday 
42,Women s Warm Scarf design  shirt  
43, New Year s Eve Party Decoration   Collection 60  Off Holiday  amp  Christmas Cards  When You Buy 60 Or More  zazzle  holiday 
44,After years of being the  pug  meme  faceswap  shirt guy  I finally tossed the  pic on some  merch  I have the  viral meme  the dope pic of my legs  my logo in  black AND  white   amp  the  grenade  logo    Please feel  free to  share  support this veteran    
45, New Year s Eve Party Decoration   Collection 60  Off Holiday  amp  Christmas Cards  When You Buy 60 Or More  zazzle  holiday 
46, design  shirt Women s Mesh Metal Wrist Watches  
47, New Year s Eve Party Decoration   Collection 60  Off Holiday  amp  Christmas Cards  When You Buy 60 Or More  zazzle  holiday 
48, New Year s Eve Party Decoration   Collection 60  Off Holiday  amp  Christmas Cards  When You Buy 60 Or More  zazzle  holiday 
49, New Year s Eve Party Decoration   Collection 60  Off Holiday  amp  Christmas Cards  When You Buy 60 Or More  zazzle  holiday 
50, New Year s Eve Party Decoration   Collection 60  Off Holiday  amp  Christmas Cards  When You Buy 60 Or More  zazzle  holiday 
51, New Year s Eve Party Decoration   Collection 60  Off Holiday  amp  Christmas Cards  When You Buy 60 Or More  zazzle  holiday 
52, Denim amp Supply Ralph Lauren Men  shirt Size L Short 
53, New Year s Eve Party Decoration   Collection 60  Off Holiday  amp  Christmas Cards  When You Buy 60 Or More  zazzle  holiday 
54, New Year s Eve Party Decoration   Collection 60  Off Holiday  amp  Christmas Cards  When You Buy 60 Or More  zazzle  holiday 
55, New Year s Eve Party Decoration   Collection 60  Off Holiday  amp  Christmas Cards  When You Buy 60 Or More  zazzle  holiday 
56, design  shirt Women s Solid Color High Waist Pencil Skirt 
57, New Year s Eve Party Decoration   Collection 60  Off Holiday  amp  Christmas Cards  When You Buy 60 Or More  zazzle  holiday 
58, New Year s Eve Party Decoration   Collection 60  Off Holiday  amp  Christmas Cards  When You Buy 60 Or More  zazzle  holiday 
59, HUGO BOSS Men  POLO  shirt Size S White with Strip 
60, New Year s Eve Party Decoration   Collection 60  Off Holiday  amp  Christmas Cards  When You Buy 60 Or More  zazzle  holiday 
61, jacket  pants Creative Michelangelo David Printed Oversize Party Women s T Shirt  
62, US  POLO Assn  Men Size S Field  amp  Track  jacket Fu 
63, jacket  pants Women s Solid Color Tassel Scarf  
64,Dolce  amp  Gabbana   Men s Jacket Men Coat Gray Black Wool Royal Crown Jacket 48 M   48m  black  coat  crown  dolce  dolceampgabbana  gabbana  gray  jacket  men  mens  royal  wool 
65,Rip Wheeler Yellowstone Black Jacket     ripwheeler  ripwheeleryellowstone  ripwheeleryellowstoneblackjacket  yellowstonejacket  yellowstone  yellowstoneblackjacket  blackjacket  jacketfashion  jacket  mkleatherja 
66, Parka Women 2020 Winter Jacket Women Coat Hooded Outwear Female Parka Thick Cotton Padded Lining Winter Female Basic Coats Z 
67,YVES SAINT LAURENT JACKET CLASSIC FLIGHT JACKET MEN S BLACK LEATHER VINTAGE YSL   black  classic  flight  jacket  laurent  leather  mens  saint  vintage  ysl  yves  yvessaintlaurent 
68,Check out Joseph Ribkoff Jacket Blazer Zip Long Sleeve Black Stretch Crinkle Satin 12 L  Jacket  via 
69,Check out Joseph Ribkoff Jacket Blazer Zip Long Sleeve Red Orange Brown Black Stretch 10 M  Jacket  via 
70, Check out what I found  Fayde Golf Mens Platinum Wet Weather Black Jacket Coat   Breathable  via 
71,Check out what I found  Fayde Golf Mens Platinum Wet Weather Black Jacket Coat   Breathable  via     Golf  Wetweather  jacket  dailydeal  christmasgift  giftforhim  keepdry 
72, Check out NEW Covington Women s Lightweight Jacket Hooded Lined size L  1X  2X  Covington  Jacket  
73,Women s Pastel Pink Nightgown with Transparent Detail  jacket  pants  
74, jacket  cool Women s Leopard Printed Neon Splicing Tee Shirt   Three Quarter Long Sleeve  
75,  PriceReduced on this  Vintage  Columbia Sport  Mens XL  Ski  Jacket  Quilted Lined Full Zip MM 5250 Black  ColumbiaJacket ht 
76, Check out NEW Covington Women s Lightweight Jacket Hooded Lined size L  1X  2X  Covington  Jacket  
77,How we await Christmas    Jacket  Colourful  Hat  Red  White  Whitedress  Sneakers  Bag  Sunglasses  TokeMakinwa  
78,  PriceReduced on this  Vintage  Columbia Sport  Mens XL  Ski  Jacket  Quilted Lined Full Zip MM 5250 Black  ColumbiaJacket ht 
79, I want to win a Regatta Great Outdoors Coat Worth up to  150  to enter  amp  Follow   amp    jacket 
80,Captain America Masked Full Zip Hoodie Jacket Mens Small S Cotton Blend  jacket  marvel  CaptainAmerica    Tweeted via  
81,This black jacket with red detail  amp  unique button closure   Buy it    women  fashion  jacket  cotton 
82,Check out Raffinalla Womens Textured Black Stretch Pants Leggings Size Extra Small  raffinalla  via   leggings  stretchpants  pants  womensfashion  fashion  womenswear  womensstyle
83,Harem pants women  Women Harem Pants Jumpsuit    clothing  women sclothing  pants amp capris  baggypants  yogaharempants 
84, Womens Trousers and more in many colors in our  shop    Contrado  trousers  pants  clothin 
85,Check out Pants Leggings Women Winter Warm Fleece Velvet Pants Lined Thermal Thick Slim   Pants  via 
86,These Silver Hawke pants glides on the body  Grab a pair at the link  pants  pantsplease  pantsdown  menswear  Mensfashion   mensthong  fashion  women  100DaysOfCode   style  coders   WomenWhoCode  streetwear   fashion  womenintech  programming   shopping  Men  javascript  Eagles 
87,These Silver Hawkes pants glides on the body  Grab a pair at the link  pants  pantsplease  pantsdown  menswear  Mensfashion   mensthong  fashion  women  100DaysOfCode   style  coders   WomenWhoCode  streetwear   fashion  womenintech  programming   shopping  Men  javascript  Eagle 
88,     Rebecca Taylor Womens Colorblock Pants Multi Combo 10   Rebecca  Taylor  Womens  Colorblock  Pants  Multi  Combo  10  fashion  lifestyle  Christmas2020   Follow the link to get it before the Christmas 
89,PT001 Thai Women Pants Organic Clothing Aladdin   clothing  women sclothing  pants amp capris  womenpants  pants 
90,New video by vidIQ  Can MrBeast Save YouTube Rewind     Shorts 
91,  MICROS Men  swimwear Size 34 Swim Board  shorts Bl 
92, MICROS Men  swimwear Size 34 Swim Board  shorts Bl 
93, Hudson  amp  Barrow Men Size 32  shorts Brown 23  long 
94,New video by vidIQ  Can MrBeast Save YouTube Rewind     Shorts 
95, Mans got rocked   americanfootball    shorts   
96,Punch and Kick Sound Effects  Shorts  via   Amongus
97,Vintage Race Bikes on the track  shorts  via 
98,Sylvie was hiding  shorts  via 
99,Magic Kingdom Castle Christmas Projection  shorts 
100,Wallybois woodworking by Marcus Kett  Stay Safe  amp  Wash your Hands   shorts  via 
101,Check out Express Jeans Precision Fit Distressed Light Wash Denim Cutoff Shorts Size 2  Express  via   denim  shorts  jeans  womensfashion  womenswear  womensstyle  distressed  fashion
102, WOMENS RELAY SHORTS      cyber drop  women s relay shorts available now    represent  womens  shor 
103, Little cuties   holiday  snowman  earrings w   peridot green crystal collars and black crystal top hats   
104,These Rainbow Creating  AuroraBorealis   AB   Rhinestone  Earrings at MarlosMarvelousFinds  Etsy Shop will Enhance Every Color You Wear   Please Stop By Often   New Listings Daily   ATSOPRO  vintage
105, Use Code Tweet20 for 20  off your order   jewelry  beaded  epiconetsy  seedbeads  gifts  christmasgiftideas  giftsforher 
106, Use Code Tweet20 for 20  off your order   jewelry  beaded  epiconetsy  seedbeads  gifts  christmasgiftideas  giftsforher 
107, Mega sparkling red  amp  green  Swarovski crystal  Christmas ornament  earrings   via 
108, Mega sparkling red  amp  green  Swarovski crystal  Christmas ornament  earrings   via 
109, Use Code Tweet20 for 20  off your order   jewelry  beaded  epiconetsy  seedbeads  gifts  christmasgiftideas  giftsforher 
110, Little cuties   holiday  snowman  earrings w   peridot green crystal collars and black crystal top hats   
111, Mega sparkling red  amp  green  Swarovski crystal  Christmas ornament  earrings   via 
112, Mega sparkling red  amp  green  Swarovski crystal  Christmas ornament  earrings   via 
113, Mega sparkling red  amp  green  Swarovski crystal  Christmas ornament  earrings   via 
114,Mega sparkling red  amp  green  Swarovski crystal  Christmas ornament  earrings   via   cctag  FreeShipping  ChristmasEarrings 
115, Use Code Tweet20 for 20  off your order   jewelry  beaded  epiconetsy  seedbeads  gifts  christmasgiftideas  giftsforher 
116,CHECK THIS OUT   blackclover  via    alhmabra  studs  unisexjewelry  earrings   cybermonday  christmasgift  fashionjewellery
117, Little cuties   holiday  snowman  earrings w   peridot green crystal collars and black crystal top hats   
118, Use Code Tweet20 for 20  off your order   jewelry  beaded  epiconetsy  seedbeads  gifts  christmasgiftideas  giftsforher 
119, Little cuties   holiday  snowman  earrings w   peridot green crystal collars and black crystal top hats   
120, Little cuties   holiday  snowman  earrings w   peridot green crystal collars and black crystal top hats   
121,Women Earrings Set Acrylic Pearl Earrings    earring  earrings  Sale Get cute Earrings for yourself  amp  x2728  Please visit our website   hiphop  man  woman  Pearl  wood  Silk  handmade  bohemia  fashion 
122, 14K Vermeil 0 80ctw Round Black Diamond Flower Cut out Dome Ring  Solid Heavy ring   statement  r 
123, GIVEAWAY  Enter to  WIN a  140  Sterling  Silver 2  Photo  Heart  Locket w  18 amp quot  box  chain   Necklace comes w   gift box  amp amp   engraving options    Contest  Prize  Present  
124, GIVEAWAY  Enter to  WIN a  140  Sterling  Silver 2  Photo  Heart  Locket w  18 amp quot  box  chain   Necklace comes w   gift box  amp amp   engraving options    Contest  Prize  Present  
125,Vintage Signed  WEISS Floral Flower  Necklace Yellow  amp  Satin  Rhinestone  Etsy    Tweeted via  
126, Black Sapphires and Silvertite Moonstone Rondells  Handmade Necklace  September Bithstone  Ladies Jewelry  Women s Acc 
127, accessories  necklace Women s Chick Shaped Brooch  
128,Vintage Signed Whiting Davis Larger Silver Tone Mother of Pearl Locket Necklace   eBay  whitingdavis  motherofpearl  necklace  vintagenecklace  vintagecostumejewelry  locket    Tweeted via  
129,White Drop Bronze Charm Necklace     necklace  opal  bead  crystal  silver  bronze  white  chain  drop  charm  925silver  jw  new  handmade  fashion  jewelry  grailed  accessories  paypal 
130, Stylish Christmas Tree Necklace   Pendant inlaid with natural  sustainably sourced  amp  rainbow hued Paua Shell   Has gla 
131,   Whiting  amp  Davis Mesh Rectangular 4   Necklace  Pendant Gold Finish Flexible  poshmark  shopmyclo 
132, Black Sapphires and Silvertite Moonstone Rondells  Handmade Necklace  September Bithstone  Ladies Jewelry  Women s Acc 
133, Check out VERSACE Vanitas EDT 100ml Spray  Versace  via   VERSACEVanitas  VERSACEPerfume   
134, CyberWeek Sale   The Perfume Spot    Up to 70  Off  Perfume  amp   Cologne   Men  amp   Women   Top Name  Brands  Huge Selection   Great  Prices     Sign Up With  Email  amp  Get 5  Off Next  Order   
135, Oud  Perfume  Attar PURE OUD ATTAR OIL FRAGRANCE FOR MENS  amp  WOMENS  The pure oud fragrance is warm  woody  earthy  animalistic with a smoky and sweet floral notes   Shop at   
136,Would you buy your wife  girlfriends don t count I know you would  an expensive bottle of perfume  My husband wouldn t so I ordered it for myself  Smells of patchouli  amp vanilla et al  Hey  I ordered the small one  Perfume  Krigler 
137,Definitely  There s nothing that would stop me using my favourite perfume  Do you agree      Perfume  Fragrance 
138,100   I don t think anything could stop me using my fave fragrance  Do you agree      Perfume  Fragrance 
139,  perfume  news    Travis Scott  Space Rage   new fragrance  Now Smell This   Pennsylvania   
140,100   I don t think anything can stop me using my fave perfume  Do you agree      Perfume  Fragrance 
141, One whale s vomit is another man s million dollar treasure   Thailand  Ambergris  Perfume  Cosmetics 
142,Oh yes  There s nothing that could stop me using my fave fragrance  Do you agree      Perfume  Fragrance 
143, One whale s vomit is another man s million dollar treasure   Thailand  Ambergris  Perfume  Cosmetics 
144,      ilok  utah  monolith  recording  mixing  daw  protools  avid  iamavid heard it in  Russia but saw it in  Cologne 
145, Lesers  EVOLUTION OF A SAD WOMAN  geheimnis  spannung  thriller  romantik  buchers about 5 men who love   1beautiful woman  amp  murder can be found at  Amazon  Germany     Berlin  Munich  Hamburg  Bremen  Cologne  GL   lese  lesen    
146,Red Tobacco by Mancera is a Woody Spicy fragrance for women and men  Now selling for only  30 000   Free Delivery  Lagos   fragrance  cologne  perfumecollection  fragrancecollection  colognecollection  perfumeaddict  manceraredtobacco  dabsng 
147,Check out     USED    Vintage Jordache Man Cologne1 7 oz Colonge Spray NO BOX RARE  Cologne  via 
148,Treat your man to a cologne that smells just like Creed  fmperfume  fmworlduk  fmdistributor  creed  Cologne  men  christmas 
149,Check out some of our in store exclusive  sales for Dec 1 6    ATL  ATLgeorgia  RiverdaleGA  ClaytonCounty  smallbusiness  supportsmallbusiness  blackowned  familyowned  gifts  deals  Christmas  Christmas2020  decorations  ornaments  wreaths  scarves  purses  perfume  cologne 
150, Government of  Algeria 7T VPR Gulfstream Aerospace GIV  rtb from  Berlin  arrived this morning with a stop at  Cologne  Presid 
151, AlpsLogic IT Solutions has experience  amp  expertise in a broad range of Microsoft technologies and languages    USA  Canada 
152, UNICEF and Microsoft launch improved  scalable technology to protect vulnerable children and women amid rise in domestic an 
153,UNICEF and Microsoft launch improved  scalable technology to protect vulnerable children and women amid rise in domestic and gender based violence due to COVID 19   Microsoft  News
154, Salesforce buying  Slack for  27 7 billion will help both brands compete against  Microsoft  Teams  by   For more on Latest News  check out our Flipboard magazine   
155, Right now at  E  amp  NinjaMoonMan wage their final war in  GearsOfWar3  Join the battle and come h 
156,Updated  windows10 got a new taskbar icon  meetnow How about NO  Was I asked to install it   Was I asked to have it show up    I want to throw up  Disgusting  Fucking  Microsoft  At least there is a  hide  option  There should be a STOP FORCING SHIT ON ME option  Goodnight 
157, oferta   AME por 3 229 15  Smart TV Samsung 65    R  3 799 00   Samsung  smartTv  BlackFriday  BlackFriday2020 
158, In this   Chat  talks with  the CEO  Listen at  
159,    You already got apple watch       It is time to protect apple watch s screen with Whitestone Dome Glass  SHOP NOW FOR THE BEST PROTECTION     whitestone  whitestone_domeglass  domeglass  samsung  protector   applewatchseries6 
160,Looking for a new 120Hz TV that won t break the budget  We might have just found the RIGHT ONE  Find out in our latest video          NANO86  LG  LGTV  NextGen  Gaming  Gamers  PS5  XboxSeriesX 
161,Listen to  Trump Social Path Diagnosis  Are You Struggling or Thriving in this Pandemic   by Grandpa Jim      phx  losangeles  lx  chico  chica  monterey  redding  reading  reno  mesa  sanjose  souix  dakota  lg  sandiego
162,if you known about Cabelas Dangerous Hunts 2009    retweet  videogaming  ps3  videogame  sony 
163,Retweet if you have heard about LittleBigPlanet 3    ps3  sony  gaming  gamers  retweet 
164,if you have ever heard of SCORE International Baja 1000    retweet  videogaming  ps3  videogame  sony 
165,if you have ever heard of SCORE International Baja 1000    retweet  videogaming  ps3  videogame  sony 
166,Enter the next generation   PS5  BlackGayNerd  Blerd  Gaymer  Gamer  GamerProblems  Sony  PlayStation 
